<?xml version="1.0" encoding="UTF-8" ?>

<OptionSeries xmlns:xsi="http://www.w3.org/2001/XMLSchema-instance" xsi:noNamespaceSchemaLocation="OptionSeries.xsd">
    <OptionSerie><Type>CALL</Type><FondsNaam>ASM LITHOGRAPHY EUR0.02</FondsNaam><Maand>7</Maand><Jaar>2002</Jaar><UitoefeningsKoers>e22,00</UitoefeningsKoers></OptionSerie>
    <OptionSerie><Type>CALL</Type><FondsNaam>ASM LITHOGRAPHY EUR0.02</FondsNaam><Maand>7</Maand><Jaar>2004</Jaar><UitoefeningsKoers>e14,00</UitoefeningsKoers></OptionSerie>
    <OptionSerie><Type>CALL</Type><FondsNaam>PHILIPS ELECTRONICS KON EUR0.20</FondsNaam><Maand>5</Maand><Jaar>2007</Jaar><UitoefeningsKoers>e32,00</UitoefeningsKoers></OptionSerie>
    <OptionSerie><Type>CALL</Type><FondsNaam>ASM LITHOGRAPHY EUR0.02</FondsNaam><Maand>6</Maand><Jaar>2007</Jaar><UitoefeningsKoers>e22,00</UitoefeningsKoers></OptionSerie>
    <OptionSerie><Type>PUT</Type><FondsNaam>TOMTOM EUR.2</FondsNaam><Maand>11</Maand><Jaar>2007</Jaar><UitoefeningsKoers>e60,00</UitoefeningsKoers></OptionSerie>
    <OptionSerie><Type>CALL</Type><FondsNaam>TOMTOM EUR.2</FondsNaam><Maand>1</Maand><Jaar>2008</Jaar><UitoefeningsKoers>e54,00</UitoefeningsKoers></OptionSerie>
    <OptionSerie><Type>CALL</Type><FondsNaam>TOMTOM EUR.2</FondsNaam><Maand>2</Maand><Jaar>2008</Jaar><UitoefeningsKoers>e46,00</UitoefeningsKoers></OptionSerie>
</OptionSeries>
